{
  "schema_version": "3.0.0-draft",
  "artifact_kind": "evidence_index",
  "candidate_id": "candidate_025",
  "release_id": "app-sha256:f88ae3a638651a182392c2b3e6a4d2937dd00f597c43efc6ae0e176abaa3b99c",
  "run_id": "local-run-73d8eaec3a8b5c97",
  "operator_run_token": "local_token_73d8eaec3a8b5c97",
  "items": [
    {
      "evidence_id": "ev.PUBLIC-01.step",
      "relative_path": "evidence/steps/ev.PUBLIC-01.step.json",
      "media_type": "application/json",
      "step_ids": [
        "PUBLIC-01"
      ]
    },
    {
      "evidence_id": "ev.PUBLIC-02.step",
      "relative_path": "evidence/steps/ev.PUBLIC-02.step.json",
      "media_type": "application/json",
      "step_ids": [
        "PUBLIC-02"
      ]
    },
    {
      "evidence_id": "ev.PUBLIC-03.step",
      "relative_path": "evidence/steps/ev.PUBLIC-03.step.json",
      "media_type": "application/json",
      "step_ids": [
        "PUBLIC-03"
      ]
    },
    {
      "evidence_id": "ev.PUBLIC-04.step",
      "relative_path": "evidence/steps/ev.PUBLIC-04.step.json",
      "media_type": "application/json",
      "step_ids": [
        "PUBLIC-04"
      ]
    },
    {
      "evidence_id": "ev.PUBLIC-05.step",
      "relative_path": "evidence/steps/ev.PUBLIC-05.step.json",
      "media_type": "application/json",
      "step_ids": [
        "PUBLIC-05"
      ]
    },
    {
      "evidence_id": "ev.PUBLIC-06.step",
      "relative_path": "evidence/steps/ev.PUBLIC-06.step.json",
      "media_type": "application/json",
      "step_ids": [
        "PUBLIC-06"
      ]
    },
    {
      "evidence_id": "ev.PUBLIC-07.step",
      "relative_path": "evidence/steps/ev.PUBLIC-07.step.json",
      "media_type": "application/json",
      "step_ids": [
        "PUBLIC-07"
      ]
    },
    {
      "evidence_id": "ev.PUBLIC-08.step",
      "relative_path": "evidence/steps/ev.PUBLIC-08.step.json",
      "media_type": "application/json",
      "step_ids": [
        "PUBLIC-08"
      ]
    },
    {
      "evidence_id": "ev.PUBLIC-09.step",
      "relative_path": "evidence/steps/ev.PUBLIC-09.step.json",
      "media_type": "application/json",
      "step_ids": [
        "PUBLIC-09"
      ]
    },
    {
      "evidence_id": "ev.PUBLIC-10.step",
      "relative_path": "evidence/steps/ev.PUBLIC-10.step.json",
      "media_type": "application/json",
      "step_ids": [
        "PUBLIC-10"
      ]
    },
    {
      "evidence_id": "ev.PUBLIC-11.step",
      "relative_path": "evidence/steps/ev.PUBLIC-11.step.json",
      "media_type": "application/json",
      "step_ids": [
        "PUBLIC-11"
      ]
    },
    {
      "evidence_id": "ev.PUBLIC-12.step",
      "relative_path": "evidence/steps/ev.PUBLIC-12.step.json",
      "media_type": "application/json",
      "step_ids": [
        "PUBLIC-12"
      ]
    },
    {
      "evidence_id": "ev.PUBLIC-13.step",
      "relative_path": "evidence/steps/ev.PUBLIC-13.step.json",
      "media_type": "application/json",
      "step_ids": [
        "PUBLIC-13"
      ]
    },
    {
      "evidence_id": "ev.state.current_goal",
      "relative_path": "evidence/state/ev.state.current_goal.json",
      "media_type": "application/json",
      "step_ids": [
        "PUBLIC-13"
      ]
    },
    {
      "evidence_id": "ev.state.context_selection",
      "relative_path": "evidence/state/ev.state.context_selection.json",
      "media_type": "application/json",
      "step_ids": [
        "PUBLIC-13"
      ]
    },
    {
      "evidence_id": "ev.state.facts",
      "relative_path": "evidence/state/ev.state.facts.json",
      "media_type": "application/json",
      "step_ids": [
        "PUBLIC-13"
      ]
    },
    {
      "evidence_id": "ev.state.authority",
      "relative_path": "evidence/state/ev.state.authority.json",
      "media_type": "application/json",
      "step_ids": [
        "PUBLIC-13"
      ]
    },
    {
      "evidence_id": "ev.state.invalidation",
      "relative_path": "evidence/state/ev.state.invalidation.json",
      "media_type": "application/json",
      "step_ids": [
        "PUBLIC-13"
      ]
    },
    {
      "evidence_id": "ev.state.recovery",
      "relative_path": "evidence/state/ev.state.recovery.json",
      "media_type": "application/json",
      "step_ids": [
        "PUBLIC-13"
      ]
    },
    {
      "evidence_id": "ev.state.deletion",
      "relative_path": "evidence/state/ev.state.deletion.json",
      "media_type": "application/json",
      "step_ids": [
        "PUBLIC-13"
      ]
    },
    {
      "evidence_id": "ev.ledger.outcomes",
      "relative_path": "evidence/ledger/ev.ledger.outcomes.json",
      "media_type": "application/json",
      "step_ids": [
        "PUBLIC-13"
      ]
    },
    {
      "evidence_id": "ev.ledger.actions",
      "relative_path": "evidence/ledger/ev.ledger.actions.json",
      "media_type": "application/json",
      "step_ids": [
        "PUBLIC-13"
      ]
    },
    {
      "evidence_id": "rc.PUBLIC-01",
      "relative_path": "evidence/receipts/rc.PUBLIC-01.json",
      "media_type": "application/json",
      "step_ids": [
        "PUBLIC-01"
      ]
    },
    {
      "evidence_id": "rc.PUBLIC-02",
      "relative_path": "evidence/receipts/rc.PUBLIC-02.json",
      "media_type": "application/json",
      "step_ids": [
        "PUBLIC-02"
      ]
    },
    {
      "evidence_id": "rc.PUBLIC-03",
      "relative_path": "evidence/receipts/rc.PUBLIC-03.json",
      "media_type": "application/json",
      "step_ids": [
        "PUBLIC-03"
      ]
    },
    {
      "evidence_id": "rc.PUBLIC-04",
      "relative_path": "evidence/receipts/rc.PUBLIC-04.json",
      "media_type": "application/json",
      "step_ids": [
        "PUBLIC-04"
      ]
    },
    {
      "evidence_id": "rc.PUBLIC-05",
      "relative_path": "evidence/receipts/rc.PUBLIC-05.json",
      "media_type": "application/json",
      "step_ids": [
        "PUBLIC-05"
      ]
    },
    {
      "evidence_id": "rc.PUBLIC-06",
      "relative_path": "evidence/receipts/rc.PUBLIC-06.json",
      "media_type": "application/json",
      "step_ids": [
        "PUBLIC-06"
      ]
    },
    {
      "evidence_id": "rc.PUBLIC-07",
      "relative_path": "evidence/receipts/rc.PUBLIC-07.json",
      "media_type": "application/json",
      "step_ids": [
        "PUBLIC-07"
      ]
    },
    {
      "evidence_id": "rc.PUBLIC-08",
      "relative_path": "evidence/receipts/rc.PUBLIC-08.json",
      "media_type": "application/json",
      "step_ids": [
        "PUBLIC-08"
      ]
    },
    {
      "evidence_id": "rc.PUBLIC-09",
      "relative_path": "evidence/receipts/rc.PUBLIC-09.json",
      "media_type": "application/json",
      "step_ids": [
        "PUBLIC-09"
      ]
    },
    {
      "evidence_id": "rc.PUBLIC-10",
      "relative_path": "evidence/receipts/rc.PUBLIC-10.json",
      "media_type": "application/json",
      "step_ids": [
        "PUBLIC-10"
      ]
    },
    {
      "evidence_id": "rc.PUBLIC-11",
      "relative_path": "evidence/receipts/rc.PUBLIC-11.json",
      "media_type": "application/json",
      "step_ids": [
        "PUBLIC-11"
      ]
    },
    {
      "evidence_id": "rc.PUBLIC-12",
      "relative_path": "evidence/receipts/rc.PUBLIC-12.json",
      "media_type": "application/json",
      "step_ids": [
        "PUBLIC-12"
      ]
    },
    {
      "evidence_id": "rc.PUBLIC-13",
      "relative_path": "evidence/receipts/rc.PUBLIC-13.json",
      "media_type": "application/json",
      "step_ids": [
        "PUBLIC-13"
      ]
    }
  ]
}
